<?xml version="1.0" encoding="UTF-8"?>

<hc:holidayConfig  xmlns:xsi='http://www.w3.org/2001/XMLSchema-instance'
   xmlns:hc='http://cismet.de/projecttracker/report/commons/holidayConfig'
   xsi:schemaLocation='http://cismet.de/projecttracker/report/commons/holidayConfig holidayConfig.xsd'>
    <hc:holiday>
        <hc:name>Neujahr</hc:name>
        <hc:isHalfHoliday>false</hc:isHalfHoliday>
        <hc:time>
            <hc:fixDate>
                <hc:date>2009-01-01</hc:date>
                <hc:isEveryYear>true</hc:isEveryYear>
            </hc:fixDate>
        </hc:time>
    </hc:holiday>
    <hc:holiday>
        <hc:name>Karfreitag</hc:name>
        <hc:isHalfHoliday>false</hc:isHalfHoliday>
        <hc:time>
            <hc:dayAfterEaster>-2</hc:dayAfterEaster>
        </hc:time>
    </hc:holiday>
    <hc:holiday>
        <hc:name>Ostermontag</hc:name>
        <hc:isHalfHoliday>false</hc:isHalfHoliday>
        <hc:time>
            <hc:dayAfterEaster>1</hc:dayAfterEaster>
        </hc:time>
    </hc:holiday>
    <hc:holiday>
        <hc:name>Maifeiertag</hc:name>
        <hc:isHalfHoliday>false</hc:isHalfHoliday>
        <hc:time>
            <hc:fixDate>
                <hc:date>2009-05-01</hc:date>
                <hc:isEveryYear>true</hc:isEveryYear>
            </hc:fixDate>
        </hc:time>
    </hc:holiday>
    <hc:holiday>
        <hc:name>Christi Himmelfahrt</hc:name>
        <hc:isHalfHoliday>false</hc:isHalfHoliday>
        <hc:time>
            <hc:dayAfterEaster>39</hc:dayAfterEaster>
        </hc:time>
    </hc:holiday>
    <hc:holiday>
        <hc:name>Pfingstmontag</hc:name>
        <hc:isHalfHoliday>false</hc:isHalfHoliday>
        <hc:time>
            <hc:dayAfterEaster>50</hc:dayAfterEaster>
        </hc:time>
    </hc:holiday>
    <hc:holiday>
        <hc:name>Fronleichnam</hc:name>
        <hc:isHalfHoliday>false</hc:isHalfHoliday>
        <hc:time>
            <hc:dayAfterEaster>60</hc:dayAfterEaster>
        </hc:time>
    </hc:holiday>
    <hc:holiday>
        <hc:name>Maria Himmelfahrt</hc:name>
        <hc:isHalfHoliday>false</hc:isHalfHoliday>
        <hc:time>
            <hc:fixDate>
                <hc:date>2009-08-15</hc:date>
                <hc:isEveryYear>true</hc:isEveryYear>
            </hc:fixDate>
        </hc:time>
    </hc:holiday>
    <hc:holiday>
        <hc:name>Tag der deutschen Einheit</hc:name>
        <hc:isHalfHoliday>false</hc:isHalfHoliday>
        <hc:time>
            <hc:fixDate>
                <hc:date>2009-10-03</hc:date>
                <hc:isEveryYear>true</hc:isEveryYear>
            </hc:fixDate>
        </hc:time>
    </hc:holiday>
    <hc:holiday>
        <hc:name>Allerheiligen</hc:name>
        <hc:isHalfHoliday>false</hc:isHalfHoliday>
        <hc:time>
            <hc:fixDate>
                <hc:date>2009-11-01</hc:date>
                <hc:isEveryYear>true</hc:isEveryYear>
            </hc:fixDate>
        </hc:time>
    </hc:holiday>
    <hc:holiday>
        <hc:name>1.Weihnachtsfeiertag</hc:name>
        <hc:isHalfHoliday>false</hc:isHalfHoliday>
        <hc:time>
            <hc:fixDate>
                <hc:date>2009-12-25</hc:date>
                <hc:isEveryYear>true</hc:isEveryYear>
            </hc:fixDate>
        </hc:time>
    </hc:holiday>
    <hc:holiday>
        <hc:name>2.Weihnachtsfeiertag</hc:name>
        <hc:isHalfHoliday>false</hc:isHalfHoliday>
        <hc:time>
            <hc:fixDate>
                <hc:date>2009-12-26</hc:date>
                <hc:isEveryYear>true</hc:isEveryYear>
            </hc:fixDate>
        </hc:time>
    </hc:holiday>
    <hc:holiday>
        <hc:name>Heiligabend</hc:name>
        <hc:isHalfHoliday>true</hc:isHalfHoliday>
        <hc:time>
            <hc:fixDate>
                <hc:date>2009-12-24</hc:date>
                <hc:isEveryYear>true</hc:isEveryYear>
            </hc:fixDate>
        </hc:time>
    </hc:holiday>
    <hc:holiday>
        <hc:name>Sylvester</hc:name>
        <hc:isHalfHoliday>true</hc:isHalfHoliday>
        <hc:time>
            <hc:fixDate>
                <hc:date>2009-12-31</hc:date>
                <hc:isEveryYear>true</hc:isEveryYear>
            </hc:fixDate>
        </hc:time>
    </hc:holiday>
    <hc:holiday>
        <hc:name>Reformationstag</hc:name>
        <hc:isHalfHoliday>false</hc:isHalfHoliday>
        <hc:time>
            <hc:fixDate>
                <hc:date>2017-10-31</hc:date>
                <hc:isEveryYear>false</hc:isEveryYear>
            </hc:fixDate>
        </hc:time>
    </hc:holiday>

</hc:holidayConfig>
